{
  "generated_at": "2026-10-30T11:44:46.840518Z",
  "model_version": "dc-xg-xi0.0025-prior0.5-alpha0.50",
  "teams": [
    {
      "team": "Arsenal",
      "p_title": 0.5884,
      "p_top4": 0.9961,
      "p_top6": 0.9994,
      "p_relegation": 0.0,
      "exp_points": 81.6545
    },
    {
      "team": "Manchester City",
      "p_title": 0.3661,
      "p_top4": 0.9862,
      "p_top6": 0.9983,
      "p_relegation": 0.0,
      "exp_points": 78.6417
    },
    {
      "team": "Liverpool",
      "p_title": 0.0287,
      "p_top4": 0.7322,
      "p_top6": 0.9162,
      "p_relegation": 0.0001,
      "exp_points": 67.2088
    },
    {
      "team": "Brighton",
      "p_title": 0.0138,
      "p_top4": 0.5759,
      "p_top6": 0.8398,
      "p_relegation": 0.0001,
      "exp_points": 64.1261
    },
    {
      "team": "Chelsea",
      "p_title": 0.0016,
      "p_top4": 0.2405,
      "p_top6": 0.5596,
      "p_relegation": 0.0024,
      "exp_points": 58.67
    },
    {
      "team": "Brentford",
      "p_title": 0.0005,
      "p_top4": 0.1083,
      "p_top6": 0.347,
      "p_relegation": 0.0084,
      "exp_points": 54.7725
    },
    {
      "team": "Bournemouth",
      "p_title": 0.0004,
      "p_top4": 0.1037,
      "p_top6": 0.3293,
      "p_relegation": 0.0079,
      "exp_points": 54.6444
    },
    {
      "team": "Aston Villa",
      "p_title": 0.0002,
      "p_top4": 0.0707,
      "p_top6": 0.2421,
      "p_relegation": 0.0159,
      "exp_points": 53.1368
    },
    {
      "team": "Leeds United",
      "p_title": 0.0001,
      "p_top4": 0.0662,
      "p_top6": 0.2318,
      "p_relegation": 0.0159,
      "exp_points": 52.6002
    },
    {
      "team": "Newcastle United",
      "p_title": 0.0002,
      "p_top4": 0.0578,
      "p_top6": 0.212,
      "p_relegation": 0.0186,
      "exp_points": 52.2685
    },
    {
      "team": "Manchester United",
      "p_title": 0.0,
      "p_top4": 0.0331,
      "p_top6": 0.1434,
      "p_relegation": 0.04,
      "exp_points": 50.0845
    },
    {
      "team": "Everton",
      "p_title": 0.0,
      "p_top4": 0.0095,
      "p_top6": 0.0523,
      "p_relegation": 0.0958,
      "exp_points": 46.4693
    },
    {
      "team": "Tottenham Hotspur",
      "p_title": 0.0,
      "p_top4": 0.0063,
      "p_top6": 0.0377,
      "p_relegation": 0.1447,
      "exp_points": 45.084
    },
    {
      "team": "Fulham",
      "p_title": 0.0,
      "p_top4": 0.0044,
      "p_top6": 0.0288,
      "p_relegation": 0.1513,
      "exp_points": 44.6094
    },
    {
      "team": "Nottingham Forest",
      "p_title": 0.0,
      "p_top4": 0.005,
      "p_top6": 0.0304,
      "p_relegation": 0.1619,
      "exp_points": 44.2545
    },
    {
      "team": "Crystal Palace",
      "p_title": 0.0,
      "p_top4": 0.0027,
      "p_top6": 0.0195,
      "p_relegation": 0.2172,
      "exp_points": 43.3723
    },
    {
      "team": "Hull City",
      "p_title": 0.0,
      "p_top4": 0.0006,
      "p_top6": 0.0059,
      "p_relegation": 0.3693,
      "exp_points": 39.9896
    },
    {
      "team": "Sunderland",
      "p_title": 0.0,
      "p_top4": 0.0005,
      "p_top6": 0.0043,
      "p_relegation": 0.4323,
      "exp_points": 39.0243
    },
    {
      "team": "Ipswich Town",
      "p_title": 0.0,
      "p_top4": 0.0003,
      "p_top6": 0.002,
      "p_relegation": 0.5094,
      "exp_points": 38.074
    },
    {
      "team": "Coventry City",
      "p_title": 0.0,
      "p_top4": 0.0,
      "p_top6": 0.0002,
      "p_relegation": 0.8088,
      "exp_points": 32.6542
    }
  ],
  "history": [
    {
      "matchweek": 5,
      "team": "Manchester City",
      "p_title": 0.5975,
      "p_top4": 0.9951,
      "p_top6": 0.9996,
      "p_relegation": 0.0,
      "exp_points": 81.6797
    },
    {
      "matchweek": 5,
      "team": "Arsenal",
      "p_title": 0.3722,
      "p_top4": 0.9864,
      "p_top6": 0.9981,
      "p_relegation": 0.0,
      "exp_points": 78.8276
    },
    {
      "matchweek": 5,
      "team": "Liverpool",
      "p_title": 0.0168,
      "p_top4": 0.6219,
      "p_top6": 0.8296,
      "p_relegation": 0.0,
      "exp_points": 64.8006
    },
    {
      "matchweek": 5,
      "team": "Brighton",
      "p_title": 0.0095,
      "p_top4": 0.4712,
      "p_top6": 0.73,
      "p_relegation": 0.0005,
      "exp_points": 61.9619
    },
    {
      "matchweek": 5,
      "team": "Brentford",
      "p_title": 0.002,
      "p_top4": 0.2227,
      "p_top6": 0.478,
      "p_relegation": 0.0027,
      "exp_points": 57.3772
    },
    {
      "matchweek": 5,
      "team": "Chelsea",
      "p_title": 0.0003,
      "p_top4": 0.14,
      "p_top6": 0.3486,
      "p_relegation": 0.0073,
      "exp_points": 55.2929
    },
    {
      "matchweek": 5,
      "team": "Newcastle United",
      "p_title": 0.0006,
      "p_top4": 0.1427,
      "p_top6": 0.3531,
      "p_relegation": 0.0081,
      "exp_points": 55.2124
    },
    {
      "matchweek": 5,
      "team": "Leeds United",
      "p_title": 0.0004,
      "p_top4": 0.1224,
      "p_top6": 0.3162,
      "p_relegation": 0.009,
      "exp_points": 54.5742
    },
    {
      "matchweek": 5,
      "team": "Manchester United",
      "p_title": 0.0004,
      "p_top4": 0.1246,
      "p_top6": 0.3198,
      "p_relegation": 0.0114,
      "exp_points": 54.3635
    },
    {
      "matchweek": 5,
      "team": "Aston Villa",
      "p_title": 0.0001,
      "p_top4": 0.0422,
      "p_top6": 0.1492,
      "p_relegation": 0.0424,
      "exp_points": 50.1463
    },
    {
      "matchweek": 5,
      "team": "Everton",
      "p_title": 0.0,
      "p_top4": 0.0457,
      "p_top6": 0.1484,
      "p_relegation": 0.0287,
      "exp_points": 50.358
    },
    {
      "matchweek": 5,
      "team": "Bournemouth",
      "p_title": 0.0001,
      "p_top4": 0.0433,
      "p_top6": 0.1425,
      "p_relegation": 0.044,
      "exp_points": 49.8316
    },
    {
      "matchweek": 5,
      "team": "Nottingham Forest",
      "p_title": 0.0001,
      "p_top4": 0.0183,
      "p_top6": 0.0758,
      "p_relegation": 0.0726,
      "exp_points": 47.4155
    },
    {
      "matchweek": 5,
      "team": "Sunderland",
      "p_title": 0.0,
      "p_top4": 0.0049,
      "p_top6": 0.0261,
      "p_relegation": 0.1792,
      "exp_points": 43.6376
    },
    {
      "matchweek": 5,
      "team": "Fulham",
      "p_title": 0.0,
      "p_top4": 0.0039,
      "p_top6": 0.0206,
      "p_relegation": 0.2147,
      "exp_points": 42.4967
    },
    {
      "matchweek": 5,
      "team": "Crystal Palace",
      "p_title": 0.0,
      "p_top4": 0.0027,
      "p_top6": 0.0151,
      "p_relegation": 0.2569,
      "exp_points": 41.9958
    },
    {
      "matchweek": 5,
      "team": "Hull City",
      "p_title": 0.0,
      "p_top4": 0.0105,
      "p_top6": 0.0427,
      "p_relegation": 0.1129,
      "exp_points": 45.6241
    },
    {
      "matchweek": 5,
      "team": "Tottenham Hotspur",
      "p_title": 0.0,
      "p_top4": 0.0014,
      "p_top6": 0.0065,
      "p_relegation": 0.3932,
      "exp_points": 39.3194
    },
    {
      "matchweek": 5,
      "team": "Ipswich Town",
      "p_title": 0.0,
      "p_top4": 0.0001,
      "p_top6": 0.0001,
      "p_relegation": 0.6798,
      "exp_points": 34.8655
    },
    {
      "matchweek": 5,
      "team": "Coventry City",
      "p_title": 0.0,
      "p_top4": 0.0,
      "p_top6": 0.0,
      "p_relegation": 0.9366,
      "exp_points": 27.9437
    },
    {
      "matchweek": 6,
      "team": "Manchester City",
      "p_title": 0.6781,
      "p_top4": 0.9984,
      "p_top6": 0.9999,
      "p_relegation": 0.0,
      "exp_points": 84.2686
    },
    {
      "matchweek": 6,
      "team": "Arsenal",
      "p_title": 0.3068,
      "p_top4": 0.9909,
      "p_top6": 0.999,
      "p_relegation": 0.0,
      "exp_points": 79.7667
    },
    {
      "matchweek": 6,
      "team": "Brighton",
      "p_title": 0.0113,
      "p_top4": 0.6538,
      "p_top6": 0.8624,
      "p_relegation": 0.0002,
      "exp_points": 64.503
    },
    {
      "matchweek": 6,
      "team": "Liverpool",
      "p_title": 0.0026,
      "p_top4": 0.4826,
      "p_top6": 0.7569,
      "p_relegation": 0.0008,
      "exp_points": 61.9166
    },
    {
      "matchweek": 6,
      "team": "Chelsea",
      "p_title": 0.0005,
      "p_top4": 0.2605,
      "p_top6": 0.5567,
      "p_relegation": 0.0034,
      "exp_points": 58.067
    },
    {
      "matchweek": 6,
      "team": "Brentford",
      "p_title": 0.0005,
      "p_top4": 0.2157,
      "p_top6": 0.4976,
      "p_relegation": 0.004,
      "exp_points": 56.8623
    },
    {
      "matchweek": 6,
      "team": "Leeds United",
      "p_title": 0.0,
      "p_top4": 0.1215,
      "p_top6": 0.3238,
      "p_relegation": 0.0135,
      "exp_points": 53.7985
    },
    {
      "matchweek": 6,
      "team": "Manchester United",
      "p_title": 0.0002,
      "p_top4": 0.0959,
      "p_top6": 0.281,
      "p_relegation": 0.0211,
      "exp_points": 52.8326
    },
    {
      "matchweek": 6,
      "team": "Newcastle United",
      "p_title": 0.0,
      "p_top4": 0.0555,
      "p_top6": 0.1822,
      "p_relegation": 0.0303,
      "exp_points": 50.9564
    },
    {
      "matchweek": 6,
      "team": "Everton",
      "p_title": 0.0,
      "p_top4": 0.0428,
      "p_top6": 0.1559,
      "p_relegation": 0.0378,
      "exp_points": 50.1154
    },
    {
      "matchweek": 6,
      "team": "Aston Villa",
      "p_title": 0.0,
      "p_top4": 0.0374,
      "p_top6": 0.1456,
      "p_relegation": 0.0533,
      "exp_points": 49.556
    },
    {
      "matchweek": 6,
      "team": "Bournemouth",
      "p_title": 0.0,
      "p_top4": 0.0131,
      "p_top6": 0.0714,
      "p_relegation": 0.1114,
      "exp_points": 46.4834
    },
    {
      "matchweek": 6,
      "team": "Hull City",
      "p_title": 0.0,
      "p_top4": 0.0096,
      "p_top6": 0.0444,
      "p_relegation": 0.1372,
      "exp_points": 45.276
    },
    {
      "matchweek": 6,
      "team": "Nottingham Forest",
      "p_title": 0.0,